PART A.

mysql> CREATE DATABASE CLIENT;
Query OK, 1 row affected (0.02 sec)

mysql> USE CLIENT;
Database changed
mysql> CREATE TABLE CLIENT_MASTER(ClientNO INT(10) PRIMARY KEY NOT NULL, Name varchar(20),Address varchar(20), city varchar(10), state varchar(15), bal_due int(10));
Query OK, 0 rows affected, 2 warnings (0.04 sec)

mysql> insert into CLIENT_MASTER VALUES(1111,'MANZI JOEL','KGL055','KIGALI CITY','RWANDA',4000);
Query OK, 1 row affected, 1 warning (0.01 sec)

mysql> insert into CLIENT_MASTER VALUES(1332,'THOMAS JOE','NY055','NEW YORK','USA',6000);
Query OK, 1 row affected (0.00 sec)

mysql> insert into CLIENT_MASTER VALUES(1342,'KAMIKAZI WINNY','MZ0584','MUSANZE','RWANDA',5000);
Query OK, 1 row affected (0.00 sec)

mysql> insert into CLIENT_MASTER VALUES(1333,'KAMIKAZI WINNY','KGL0234','KIGALI CITY','RWANDA',5500);
Query OK, 1 row affected, 1 warning (0.00 sec)

mysql> insert into CLIENT_MASTER VALUES(1356,'KIMENYI TONNY','HUYE154','HUYE CITY','RWANDA',7500);
Query OK, 1 row affected (0.00 sec)

mysql> SELECT*FROM CLIENT_MASTER;
+----------+----------------+---------+------------+--------+---------+
| ClientNO | Name           | Address | city       | state  | bal_due |
+----------+----------------+---------+------------+--------+---------+
|     1111 | MANZI JOEL     | KGL055  | KIGALI CIT | RWANDA |    4000 |
|     1332 | THOMAS JOE     | NY055   | NEW YORK   | USA    |    6000 |
|     1342 | KAMIKAZI WINNY | MZ0584  | MUSANZE    | RWANDA |    5000 |
|     1333 | KAMIKAZI WINNY | KGL0234 | KIGALI CIT | RWANDA |    5500 |
|     1356 | KIMENYI TONNY  | HUYE154 | HUYE CITY  | RWANDA |    7500 |
+----------+----------------+---------+------------+--------+---------+
5 rows in set (0.01 sec)

mysql> SELECT NAME FROM CLIENT_MASTER WHERE bal_due>5000;
+----------------+
| NAME           |
+----------------+
| THOMAS JOE     |
| KAMIKAZI WINNY |
| KIMENYI TONNY  |
+----------------+
3 rows in set (0.01 sec)

mysql> alter table client_master modify client_master varchar(10);
ERROR 1054 (42S22): Unknown column 'client_master' in 'client_master'
mysql> alter table client_master modify ClientNO varchar(10);
Query OK, 5 rows affected (0.05 sec)
Records: 5  Duplicates: 0  Warnings: 0

mysql> insert into CLIENT_MASTER VALUES('C123','UWERA ANNET','HUYE157','HUYE CITY','RWANDA',7500);
Query OK, 1 row affected (0.00 sec)

mysql> SELECT*FROM CLIENT_MASTER;
+----------+----------------+---------+------------+--------+---------+
| ClientNO | Name           | Address | city       | state  | bal_due |
+----------+----------------+---------+------------+--------+---------+
| 1111     | MANZI JOEL     | KGL055  | KIGALI CIT | RWANDA |    4000 |
| 1332     | THOMAS JOE     | NY055   | NEW YORK   | USA    |    6000 |
| 1342     | KAMIKAZI WINNY | MZ0584  | MUSANZE    | RWANDA |    5000 |
| 1333     | KAMIKAZI WINNY | KGL0234 | KIGALI CIT | RWANDA |    5500 |
| 1356     | KIMENYI TONNY  | HUYE154 | HUYE CITY  | RWANDA |    7500 |
| C123     | UWERA ANNET    | HUYE157 | HUYE CITY  | RWANDA |    7500 |
+----------+----------------+---------+------------+--------+---------+
6 rows in set (0.00 sec)

mysql> alter table client_master modify bal_due varchar(10);
Query OK, 6 rows affected (0.03 sec)
Records: 6  Duplicates: 0  Warnings: 0

mysql> update client_master set bal_due='Rs. 5100' where clientNO='C123';
Query OK, 1 row affected (0.01 sec)
Rows matched: 1  Changed: 1  Warnings: 0

mysql> SELECT*FROM CLIENT_MASTER;
+----------+----------------+---------+------------+--------+----------+
| ClientNO | Name           | Address | city       | state  | bal_due  |
+----------+----------------+---------+------------+--------+----------+
| 1111     | MANZI JOEL     | KGL055  | KIGALI CIT | RWANDA | 4000     |
| 1332     | THOMAS JOE     | NY055   | NEW YORK   | USA    | 6000     |
| 1342     | KAMIKAZI WINNY | MZ0584  | MUSANZE    | RWANDA | 5000     |
| 1333     | KAMIKAZI WINNY | KGL0234 | KIGALI CIT | RWANDA | 5500     |
| 1356     | KIMENYI TONNY  | HUYE154 | HUYE CITY  | RWANDA | 7500     |
| C123     | UWERA ANNET    | HUYE157 | HUYE CITY  | RWANDA | Rs. 5100 |
+----------+----------------+---------+------------+--------+----------+
6 rows in set (0.00 sec)

mysql> select bal_due from client_master as BALANCE;
+----------+
| bal_due  |
+----------+
| 4000     |
| 6000     |
| 5000     |
| 5500     |
| 7500     |
| Rs. 5100 |
+----------+
6 rows in set (0.00 sec)

mysql> select bal_due from client_master SET as BALANCE;
ERROR 1064 (42000): You have an error in your SQL syntax; check the manual that corresponds to your MySQL server version for the right syntax to use near 'SET as BALANCE' at line 1
mysql> Alter table client_master set bal_due as 'BALANCE';
ERROR 1064 (42000): You have an error in your SQL syntax; check the manual that corresponds to your MySQL server version for the right syntax to use near 'set bal_due as 'BALANCE'' at line 1
mysql> Alter table client_master set bal_due as BALANCE;
ERROR 1064 (42000): You have an error in your SQL syntax; check the manual that corresponds to your MySQL server version for the right syntax to use near 'set bal_due as BALANCE' at line 1
mysql> Alter table client_master DISPLAY bal_due as BALANCE;
ERROR 1064 (42000): You have an error in your SQL syntax; check the manual that corresponds to your MySQL server version for the right syntax to use near 'DISPLAY bal_due as BALANCE' at line 1
mysql> SELECT bal_due from client_master AS BALANCE;
+----------+
| bal_due  |
+----------+
| 4000     |
| 6000     |
| 5000     |
| 5500     | 		
| 7500     |
| Rs. 5100 |
+----------+
6 rows in set (0.00 sec)

mysql> RENAME CLIENT_MASTER TO CLIENT12;
ERROR 1064 (42000): You have an error in your SQL syntax; check the manual that corresponds to your MySQL server version for the right syntax to use near 'CLIENT_MASTER TO CLIENT12' at line 1
mysql> RENAME TABLE CLIENT_MASTER TO CLIENT12;
Query OK, 0 rows affected (0.02 sec)

mysql> SELECT*FROM CLIENT12;
+----------+----------------+---------+------------+--------+----------+
| ClientNO | Name           | Address | city       | state  | bal_due  |
+----------+----------------+---------+------------+--------+----------+
| 1111     | MANZI JOEL     | KGL055  | KIGALI CIT | RWANDA | 4000     |
| 1332     | THOMAS JOE     | NY055   | NEW YORK   | USA    | 6000     |
| 1342     | KAMIKAZI WINNY | MZ0584  | MUSANZE    | RWANDA | 5000     |
| 1333     | KAMIKAZI WINNY | KGL0234 | KIGALI CIT | RWANDA | 5500     |
| 1356     | KIMENYI TONNY  | HUYE154 | HUYE CITY  | RWANDA | 7500     |
| C123     | UWERA ANNET    | HUYE157 | HUYE CITY  | RWANDA | Rs. 5100 |
+----------+----------------+---------+------------+--------+----------+
6 rows in set (0.01 sec)

PART B Q6.

mysql> CREATE TABLE departments(dep_id int PRIMARY KEY,dep_name varchar(250),dep_no_employees int);CREATE TABLE employees(emp_id int primary key,emp_name varchar(250),emp_salary int,department_id int,FOREIGN KEY(department_id) REFERENCES departments(dep_id));
Query OK, 0 rows affected (0.02 sec)

Query OK, 0 rows affected (0.02 sec)

mysql> insert INTO departments VALUES(100,"IT",50);insert INTO departments VALUES(200,"data science",80);insert INTO departments VALUES(300,"Software engineering",10);insert INTO departments VALUES(400,"cloud computing",40);insert INTO departments VALUES(500,"HRM",10);
Query OK, 1 row affected (0.01 sec)

Query OK, 1 row affected (0.00 sec)

Query OK, 1 row affected (0.00 sec)

Query OK, 1 row affected (0.00 sec)

Query OK, 1 row affected (0.00 sec)

mysql>    INSERT INTO employees VALUES(101,"MUSABIKA Fidele",900000,300);INSERT INTO employees VALUES(102,"Rudasingwa Allan",700000,200);INSERT INTO employees VALUES(103,"MUUGISHA Yves",400000,400);INSERT INTO employees VALUES(104,"MUGISHA Eumenne",600000,100);INSERT INTO employees VALUES(105,"Hirwa Narada",1000000,500);
Query OK, 1 row affected (0.01 sec)

Query OK, 1 row affected (0.00 sec)

Query OK, 1 row affected (0.00 sec)

Query OK, 1 row affected (0.00 sec)

Query OK, 1 row affected (0.00 sec)

mysql>  DESC employees;
+---------------+--------------+------+-----+---------+-------+
| Field         | Type         | Null | Key | Default | Extra |
+---------------+--------------+------+-----+---------+-------+
| emp_id        | int          | NO   | PRI | NULL    |       |
| emp_name      | varchar(250) | YES  |     | NULL    |       |
| emp_salary    | int          | YES  |     | NULL    |       |
| department_id | int          | YES  | MUL | NULL    |       |
+---------------+--------------+------+-----+---------+-------+
4 rows in set (0.02 sec)

mysql> describe employees;
+---------------+--------------+------+-----+---------+-------+
| Field         | Type         | Null | Key | Default | Extra |
+---------------+--------------+------+-----+---------+-------+
| emp_id        | int          | NO   | PRI | NULL    |       |
| emp_name      | varchar(250) | YES  |     | NULL    |       |
| emp_salary    | int          | YES  |     | NULL    |       |
| department_id | int          | YES  | MUL | NULL    |       |
+---------------+--------------+------+-----+---------+-------+
4 rows in set (0.00 sec)

mysql>  select employees.emp_name,departments.dep_name FROM employees left JOIN departments ON departments.dep_id = employees.emp_id
    -> ;
+------------------+----------+
| emp_name         | dep_name |
+------------------+----------+
| MUSABIKA Fidele  | NULL     |
| Rudasingwa Allan | NULL     |
| MUUGISHA Yves    | NULL     |
| MUGISHA Eumenne  | NULL     |
| Hirwa Narada     | NULL     |
+------------------+----------+
5 rows in set (0.00 sec)

mysql> select employees.emp_name,departments.dep_name FROM employees RIGHT JOIN departments ON departments.dep_id = employees.emp_id;
+----------+----------------------+
| emp_name | dep_name             |
+----------+----------------------+
| NULL     | IT                   |
| NULL     | data science         |
| NULL     | Software engineering |
| NULL     | cloud computing      |
| NULL     | HRM                  |
+----------+----------------------+
5 rows in set (0.00 sec)

mysql>  SELECT *FROM employeesWHERE emp_salary > (SELECT AVG(emp_salary) FROM employees);
ERROR 1064 (42000): You have an error in your SQL syntax; check the manual that corresponds to your MySQL server version for the right syntax to use near '> (SELECT AVG(emp_salary) FROM employees)' at line 1
mysql> SELECT *FROM employeesWHERE emp_salary > (SELECT AVG(emp_salary) FROM employees);
ERROR 1064 (42000): You have an error in your SQL syntax; check the manual that corresponds to your MySQL server version for the right syntax to use near '> (SELECT AVG(emp_salary) FROM employees)' at line 1
mysql> select *
    -> from employees
    -> WHERE emp_salary > (SELECT
    -> AVG(emp_salary) FROM employees);
+--------+-----------------+------------+---------------+
| emp_id | emp_name        | emp_salary | department_id |
+--------+-----------------+------------+---------------+
|    101 | MUSABIKA Fidele |     900000 |           300 |
|    105 | Hirwa Narada    |    1000000 |           500 |
+--------+-----------------+------------+---------------+
2 rows in set (0.01 sec)


PART B Q7.

mysql> CREATE TABLE STUDENT(studentID VARCHAR(5),FULLNAMES VARCHAR(25),GENDER VARCHAR(6),AGE INT(2),DEPARTMENT VARCHAR(30));
Query OK, 0 rows affected, 1 warning (0.01 sec)

mysql> insert into student values( 'BIT11','UWASE NINA','FEMALE',20,'BUSINESS INFORMATION TECH');
Query OK, 1 row affected (0.00 sec)

mysql> insert into student values( 'BIT12','KALISA AMOS','MALE',20,'BUSINESS INFORMATION TECH');
Query OK, 1 row affected (0.00 sec)

mysql> insert into student values( 'ACC12','GATETE JACK','MALE',22,'ACCOUNTING&FINANCE');
Query OK, 1 row affected (0.00 sec)

mysql> insert into student values( 'ACC13','GATESI ANAH','FEMALE',22,'ACCOUNTING&FINANCE');
Query OK, 1 row affected (0.00 sec)

mysql> insert into student values( 'ACC14','MWIZA TONAH','FEMALE',22,'ACCOUNTING&FINANCE');
Query OK, 1 row affected (0.00 sec)

mysql> SELECT*FROM STUDENT;
+-----------+-------------+--------+------+---------------------------+
| studentID | FULLNAMES   | GENDER | AGE  | DEPARTMENT                |
+-----------+-------------+--------+------+---------------------------+
| BIT11     | UWASE NINA  | FEMALE |   20 | BUSINESS INFORMATION TECH |
| BIT12     | KALISA AMOS | MALE   |   20 | BUSINESS INFORMATION TECH |
| ACC12     | GATETE JACK | MALE   |   22 | ACCOUNTING&FINANCE        |
| ACC13     | GATESI ANAH | FEMALE |   22 | ACCOUNTING&FINANCE        |
| ACC14     | MWIZA TONAH | FEMALE |   22 | ACCOUNTING&FINANCE        |
+-----------+-------------+--------+------+---------------------------+
5 rows in set (0.00 sec)

mysql> SELECT*FROM STUDENT WHERE GENDER='FEMALE';
+-----------+-------------+--------+------+---------------------------+
| studentID | FULLNAMES   | GENDER | AGE  | DEPARTMENT                |
+-----------+-------------+--------+------+---------------------------+
| BIT11     | UWASE NINA  | FEMALE |   20 | BUSINESS INFORMATION TECH |
| ACC13     | GATESI ANAH | FEMALE |   22 | ACCOUNTING&FINANCE        |
| ACC14     | MWIZA TONAH | FEMALE |   22 | ACCOUNTING&FINANCE        |
+-----------+-------------+--------+------+---------------------------+
3 rows in set (0.00 sec)

mysql> SELECT*FROM STUDENT WHERE GENDER='MALE';
+-----------+-------------+--------+------+---------------------------+
| studentID | FULLNAMES   | GENDER | AGE  | DEPARTMENT                |
+-----------+-------------+--------+------+---------------------------+
| BIT12     | KALISA AMOS | MALE   |   20 | BUSINESS INFORMATION TECH |
| ACC12     | GATETE JACK | MALE   |   22 | ACCOUNTING&FINANCE        |
+-----------+-------------+--------+------+---------------------------+
2 rows in set (0.00 sec)

mysql> DELETE FROM STUDENT WHERE AGE<20;
Query OK, 0 rows affected (0.01 sec)


PART C Q9.

mysql> CREATE TABLE EMPLOYEEE(EMPLOYEE_ID INT(10),FIRST_NAME CHAR(20),LAST_NAME CHAR(10),EMAIL VARCHAR(30),PHONE_NUMBER INT(20),HIRE_DATE DATE,JOB_ID INT(23),SALARY INT(20),COMMISSION_PCT VARCHAR(10),MANAGER_ID INT(10), DEPARTMENT_ID INT(10));
Query OK, 0 rows affected, 6 warnings (0.02 sec)

mysql> INSERT INTO EMPLOYEE VALUES(1122,'UMWAMI','TITO','TITO123@GMAIL.COM',0789654532,2022-05-15,089,500000,'P123',100,50);
ERROR 1146 (42S02): Table 'client.employee' doesn't exist
mysql> INSERT INTO EMPLOYEEE VALUES(1122,'UMWAMI','TITO','TITO123@GMAIL.COM',0789654532,2022-05-15,089,500000,'P123',100,50);
Query OK, 1 row affected, 1 warning (0.01 sec)

mysql> SELECT*FROM EMPLOYEEE;
+-------------+------------+-----------+-------------------+--------------+------------+--------+--------+----------------+------------+---------------+
| EMPLOYEE_ID | FIRST_NAME | LAST_NAME | EMAIL             | PHONE_NUMBER | HIRE_DATE  | JOB_ID | SALARY | COMMISSION_PCT | MANAGER_ID | DEPARTMENT_ID |
+-------------+------------+-----------+-------------------+--------------+------------+--------+--------+----------------+------------+---------------+
|        1122 | UMWAMI     | TITO      | TITO123@GMAIL.COM |    789654532 | 0000-00-00 |     89 | 500000 | P123           |        100 |            50 |
+-------------+------------+-----------+-------------------+--------------+------------+--------+--------+----------------+------------+---------------+
1 row in set (0.00 sec)

mysql> INSERT INTO EMPLOYEEE VALUES(1123,'KAYUMBA','JAMES','JAMES123@GMAIL.COM',0781654532,2022.09.18,089,450000,'P124',100,50);
ERROR 1064 (42000): You have an error in your SQL syntax; check the manual that corresponds to your MySQL server version for the right syntax to use near '.18,089,450000,'P124',100,50)' at line 1
mysql> INSERT INTO EMPLOYEEE VALUES(1123,'KAYUMBA','JAMES','JAMES123@GMAIL.COM',0781654532,2022-09-18,089,450000,'P124',100,50);
Query OK, 1 row affected, 1 warning (0.00 sec)

mysql> INSERT INTO EMPLOYEEE VALUES(1124,'KAYIRA','AMOS','AMOS123@GMAIL.COM',0781654572,2023-07-18,085,200000,'P126',101,60);
Query OK, 1 row affected, 1 warning (0.00 sec)

mysql> SELECT*FROM EMPLOYEEE;
+-------------+------------+-----------+--------------------+--------------+------------+--------+--------+----------------+------------+---------------+
| EMPLOYEE_ID | FIRST_NAME | LAST_NAME | EMAIL              | PHONE_NUMBER | HIRE_DATE  | JOB_ID | SALARY | COMMISSION_PCT | MANAGER_ID | DEPARTMENT_ID |
+-------------+------------+-----------+--------------------+--------------+------------+--------+--------+----------------+------------+---------------+
|        1122 | UMWAMI     | TITO      | TITO123@GMAIL.COM  |    789654532 | 0000-00-00 |     89 | 500000 | P123           |        100 |            50 |
|        1123 | KAYUMBA    | JAMES     | JAMES123@GMAIL.COM |    781654532 | 0000-00-00 |     89 | 450000 | P124           |        100 |            50 |
|        1124 | KAYIRA     | AMOS      | AMOS123@GMAIL.COM  |    781654572 | 0000-00-00 |     85 | 200000 | P126           |        101 |            60 |
+-------------+------------+-----------+--------------------+--------------+------------+--------+--------+----------------+------------+---------------+
3 rows in set (0.00 sec)

mysql> SELECT EMPLOYEE_ID,FIRST_NAME,LAST_NAME,SALARY FROM EMPLOYEEE;
+-------------+------------+-----------+--------+
| EMPLOYEE_ID | FIRST_NAME | LAST_NAME | SALARY |
+-------------+------------+-----------+--------+
|        1122 | UMWAMI     | TITO      | 500000 |
|        1123 | KAYUMBA    | JAMES     | 450000 |
|        1124 | KAYIRA     | AMOS      | 200000 |
+-------------+------------+-----------+--------+
3 rows in set (0.00 sec)

mysql> SELECT EMPLOYEE_ID,FIRST_NAME,LAST_NAME,SALARY FROM EMPLOYEEE WHERE MANAGER_ID =100;
+-------------+------------+-----------+--------+
| EMPLOYEE_ID | FIRST_NAME | LAST_NAME | SALARY |
+-------------+------------+-----------+--------+
|        1122 | UMWAMI     | TITO      | 500000 |
|        1123 | KAYUMBA    | JAMES     | 450000 |
+-------------+------------+-----------+--------+
2 rows in set (0.00 sec)

mysql> SELECT FIRST_NAME,LAST_NAME FROM EMPLOYEEE WHERE SALARY>= 4800;
+------------+-----------+
| FIRST_NAME | LAST_NAME |
+------------+-----------+
| UMWAMI     | TITO      |
| KAYUMBA    | JAMES     |
| KAYIRA     | AMOS      |
+------------+-----------+
3 rows in set (0.00 sec)

mysql> SELECT*FROM EMPLOYEEE WHERE SALARY>= 4800;
+-------------+------------+-----------+--------------------+--------------+------------+--------+--------+----------------+------------+---------------+
| EMPLOYEE_ID | FIRST_NAME | LAST_NAME | EMAIL              | PHONE_NUMBER | HIRE_DATE  | JOB_ID | SALARY | COMMISSION_PCT | MANAGER_ID | DEPARTMENT_ID |
+-------------+------------+-----------+--------------------+--------------+------------+--------+--------+----------------+------------+---------------+
|        1122 | UMWAMI     | TITO      | TITO123@GMAIL.COM  |    789654532 | 0000-00-00 |     89 | 500000 | P123           |        100 |            50 |
|        1123 | KAYUMBA    | JAMES     | JAMES123@GMAIL.COM |    781654532 | 0000-00-00 |     89 | 450000 | P124           |        100 |            50 |
|        1124 | KAYIRA     | AMOS      | AMOS123@GMAIL.COM  |    781654572 | 0000-00-00 |     85 | 200000 | P126           |        101 |            60 |
+-------------+------------+-----------+--------------------+--------------+------------+--------+--------+----------------+------------+---------------+
3 rows in set (0.00 sec)

mysql> SELECT*FROM EMPLOYEEE WHERE LAST_NAME='AUSTIN';
Empty set (0.00 sec)

mysql> SELECT FIRST_NAME,LAST_NAME FROM EMPLOYEEE WHERE DEPARTMENT_ID= 60,70 AND 80;
ERROR 1064 (42000): You have an error in your SQL syntax; check the manual that corresponds to your MySQL server version for the right syntax to use near ',70 AND 80' at line 1
mysql> SELECT FIRST_NAME,LAST_NAME FROM EMPLOYEEE WHERE DEPARTMENT_ID= (60,70 AND 80);
ERROR 1241 (21000): Operand should contain 1 column(s)
mysql> SELECT FIRST_NAME,LAST_NAME FROM EMPLOYEEE WHERE DEPARTMENT_ID= (60 AND 70);
Empty set (0.01 sec)

mysql> SELECT FIRST_NAME,LAST_NAME FROM EMPLOYEEE WHERE DEPARTMENT_ID= 60;
+------------+-----------+
| FIRST_NAME | LAST_NAME |
+------------+-----------+
| KAYIRA     | AMOS      |
+------------+-----------+
1 row in set (0.00 sec)

mysql> SELECT FIRST_NAME,LAST_NAME FROM EMPLOYEEE WHERE DEPARTMENT_ID= 70;
Empty set (0.00 sec)

mysql> SELECT FIRST_NAME,LAST_NAME FROM EMPLOYEEE WHERE DEPARTMENT_ID= 80;
Empty set (0.00 sec)



PART C Q10.

mysql> CREATE TABLE Sales (    SalesNo INT PRIMARY KEY,    SalesName VARCHAR(255),    Branch VARCHAR(255),    SalesAmount DECIMAL(10,2),    DOB DATE);
Query OK, 0 rows affected (0.02 sec)

mysql> INSERT INTO Sales (SalesNo, SalesName, Branch, SalesAmount, DOB)VALUES(1, 'John Doe', 'New York', 5000.50, '1990-12-21'),(2, 'Alice Smith', 'Los Angeles', 7000.75, '1985-05-14'),(3, 'Bob Johnson', 'Chicago', 6200.60, '1992-12-10'),(4, 'Eve Adams', 'New York', 5400.30, '1988-07-23'),(5, 'Charlie Brown', 'Los Angeles', 8000.80, '1995-12-05');
Query OK, 5 rows affected (0.01 sec)
Records: 5  Duplicates: 0  Warnings: 0

mysql> SELECT*FROM Sales;
+---------+---------------+-------------+-------------+------------+
| SalesNo | SalesName     | Branch      | SalesAmount | DOB        |
+---------+---------------+-------------+-------------+------------+
|       1 | John Doe      | New York    |     5000.50 | 1990-12-21 |
|       2 | Alice Smith   | Los Angeles |     7000.75 | 1985-05-14 |
|       3 | Bob Johnson   | Chicago     |     6200.60 | 1992-12-10 |
|       4 | Eve Adams     | New York    |     5400.30 | 1988-07-23 |
|       5 | Charlie Brown | Los Angeles |     8000.80 | 1995-12-05 |
+---------+---------------+-------------+-------------+------------+
5 rows in set (0.00 sec)

mysql> SELECT Branch, SUM(SalesAmount) AS TotalSalesFROM SalesGROUP BY Branch;
ERROR 1064 (42000): You have an error in your SQL syntax; check the manual that corresponds to your MySQL server version for the right syntax to use near 'SalesGROUP BY Branch' at line 1
mysql> SELECT Branch, SUM(SalesAmount) AS TotalSales FROM Sales GROUP BY Branch;
+-------------+------------+
| Branch      | TotalSales |
+-------------+------------+
| New York    |   10400.80 |
| Los Angeles |   15001.55 |
| Chicago     |    6200.60 |
+-------------+------------+
3 rows in set (0.01 sec)

mysql> SELECT Branch, AVG(SalesAmount) AS AverageSales FROM Sales GROUP BY Branch;
+-------------+--------------+
| Branch      | AverageSales |
+-------------+--------------+
| New York    |  5200.400000 |
| Los Angeles |  7500.775000 |
| Chicago     |  6200.600000 |
+-------------+--------------+
3 rows in set (0.01 sec)

mysql> SELECT SalesName, DATE_FORMAT(DOB, '%d-%b-%y') AS Formatted DOB FROM Sales WHERE MONTH(DOB) = 12;
ERROR 1064 (42000): You have an error in your SQL syntax; check the manual that corresponds to your MySQL server version for the right syntax to use near 'DOB FROM Sales WHERE MONTH(DOB) = 12' at line 1
mysql> SELECT SalesName, DATE_FORMAT(DOB, '%d-%b-%y') AS FormattedDOB FROM Sales WHERE MONTH(DOB) = 12;
+---------------+--------------+
| SalesName     | FormattedDOB |
+---------------+--------------+
| John Doe      | 21-Dec-90    |
| Bob Johnson   | 10-Dec-92    |
| Charlie Brown | 05-Dec-95    |
+---------------+--------------+
3 rows in set (0.01 sec)

mysql> SELECT SalesName, DOB FROM Sales ORDER BY MONTH(DOB), DAY(DOB);
+---------------+------------+
| SalesName     | DOB        |
+---------------+------------+
| Alice Smith   | 1985-05-14 |
| Eve Adams     | 1988-07-23 |
| Charlie Brown | 1995-12-05 |
| Bob Johnson   | 1992-12-10 |
| John Doe      | 1990-12-21 |
+---------------+------------+
5 rows in set (0.01 sec)

END.
